Position,Const,Created,Modified,Description,Title,Original Title,URL,Title Type,IMDb Rating,Runtime (mins),Year,Genres,Num Votes,Release Date,Directors,Your Rating,Date Rated
867,tt0095199,2019-12-05,2020-08-13,"Excerpt from Les Blank: A Quiet Revelation, a film project by Harrod Blank and Gina Leibrecht New interviews with Blank’s sons, Harrod and Beau; Blank documentary subject Gerald Gaxiola (a.k.a. the Maestro); Blank’s friends and collaborators Skip Gerson, Maureen Gosling, Taylor Hackford, Werner Herzog, Susan Kell, Tom Luddy, David Silberberg, and Chris Simon; and chef and author Alice Waters Related shorts by Blank: The Sun’s Gonna Shine (1968), More Fess (1978), Julie: Old Time Tales of the Blue Ridge (1991), My Old Fiddle: A Visit with Tommy Jarrell in the Blue Ridge (1994), and The Maestro Rides Again (2005) Two outtake performances from The Blues Accordin’ to Lightnin’ Hopkins","Gap-Toothed Women","Gap-Toothed Women",https://www.imdb.com/title/tt0095199/,Short,7.2,31,1987,"Short, Documentary",503,1988-02,"Les Blank",,
868,tt0100997,2019-12-05,2020-08-13,"Excerpt from Les Blank: A Quiet Revelation, a film project by Harrod Blank and Gina Leibrecht New interviews with Blank’s sons, Harrod and Beau; Blank documentary subject Gerald Gaxiola (a.k.a. the Maestro); Blank’s friends and collaborators Skip Gerson, Maureen Gosling, Taylor Hackford, Werner Herzog, Susan Kell, Tom Luddy, David Silberberg, and Chris Simon; and chef and author Alice Waters Related shorts by Blank: The Sun’s Gonna Shine (1968), More Fess (1978), Julie: Old Time Tales of the Blue Ridge (1991), My Old Fiddle: A Visit with Tommy Jarrell in the Blue Ridge (1994), and The Maestro Rides Again (2005) Two outtake performances from The Blues Accordin’ to Lightnin’ Hopkins","Yum, Yum, Yum! A Taste of the Cajun and Creole Cooking of Louisiana","Yum, Yum, Yum! A Taste of the Cajun and Creole Cooking of Louisiana",https://www.imdb.com/title/tt0100997/,Short,7.3,31,1990,"Documentary, Short",326,2005-09-07,"Les Blank",,
869,tt0113734,2019-12-05,2020-08-13,"Excerpt from Les Blank: A Quiet Revelation, a film project by Harrod Blank and Gina Leibrecht New interviews with Blank’s sons, Harrod and Beau; Blank documentary subject Gerald Gaxiola (a.k.a. the Maestro); Blank’s friends and collaborators Skip Gerson, Maureen Gosling, Taylor Hackford, Werner Herzog, Susan Kell, Tom Luddy, David Silberberg, and Chris Simon; and chef and author Alice Waters Related shorts by Blank: The Sun’s Gonna Shine (1968), More Fess (1978), Julie: Old Time Tales of the Blue Ridge (1991), My Old Fiddle: A Visit with Tommy Jarrell in the Blue Ridge (1994), and The Maestro Rides Again (2005) Two outtake performances from The Blues Accordin’ to Lightnin’ Hopkins","The Maestro: King of the Cowboy Artists","The Maestro: King of the Cowboy Artists",https://www.imdb.com/title/tt0113734/,Movie,7.0,54,1995,"Documentary",277,2013-11-01,"Les Blank",,
870,tt0114595,2019-12-05,2020-08-13,"Excerpt from Les Blank: A Quiet Revelation, a film project by Harrod Blank and Gina Leibrecht New interviews with Blank’s sons, Harrod and Beau; Blank documentary subject Gerald Gaxiola (a.k.a. the Maestro); Blank’s friends and collaborators Skip Gerson, Maureen Gosling, Taylor Hackford, Werner Herzog, Susan Kell, Tom Luddy, David Silberberg, and Chris Simon; and chef and author Alice Waters Related shorts by Blank: The Sun’s Gonna Shine (1968), More Fess (1978), Julie: Old Time Tales of the Blue Ridge (1991), My Old Fiddle: A Visit with Tommy Jarrell in the Blue Ridge (1994), and The Maestro Rides Again (2005) Two outtake performances from The Blues Accordin’ to Lightnin’ Hopkins","Sworn to the Drum: A Tribute to Francisco Aguabella","Sworn to the Drum: A Tribute to Francisco Aguabella",https://www.imdb.com/title/tt0114595/,Short,6.7,35,1995,"Documentary, Short, Music",159,1995-10,"Les Blank",,
871,tt0084805,2019-12-05,2020-08-13,"Audio Commentary by director Sydney Pollack New interviews with actor Dustin Hoffman and comedy writer Phil Rosenthal Interview with Dorothy Michaels by film critic Gene Shalit Making of “Tootsie” (1982) and A Better Man: The Making of “Tootsie” (2007), two documentaries featuring interviews with cast and crew Screen and wardrobe test footage Deleted scenes and trailers","Tootsie","Tootsie",https://www.imdb.com/title/tt0084805/,Movie,7.4,116,1982,"Comedy, Drama, Romance",119422,1982-12-17,"Sydney Pollack",,
872,tt0114323,2019-12-05,2020-08-13,"Audio Commentary by Todd Haynes, actor Julianne Moore, and producer Christine Vachon New conversation between Haynes and Moore The Suicide, a 1978 short film by Haynes New interview with Vachon Trailer","Safe","Safe",https://www.imdb.com/title/tt0114323/,Movie,7.1,119,1995,"Drama",18587,1995-06-30,"Todd Haynes",,
873,tt0068278,2019-12-05,2020-08-13,"New interviews with Ballhaus and actors Margit Carstensen, Eva Mattes, Katrin Schaake, and Hanna Schygulla New interview with film scholar Jane Shattuc Role Play: Women on Fassbinder, a 1992 German television documentary by Thomas Honickel featuring interviews with Carstensen, Schygulla, and actors Irm Hermann and Rosel Zech ","The Bitter Tears of Petra von Kant","Die bitteren Tränen der Petra von Kant",https://www.imdb.com/title/tt0068278/,Movie,7.5,124,1972,"Drama, Romance",11959,1972-10-05,"Rainer Werner Fassbinder",,
874,tt1093842,2019-12-05,2020-08-13,"New conversation between Maddin and art critic Robert Enright My Winnipeg” Live in Toronto, a 2008 featurette Four 2014 cine-essays by filmmaker Evan Johnson and Maddin on various Winnipegiana Five Maddin shorts, the first three with new introductions by the director: Spanky: To the Pier and Back (2008), Sinclair (2010), Only Dream Things (2012), The Hall Runner (2014), and Louis Riel for Dinner (2014) Trailer ","My Winnipeg","My Winnipeg",https://www.imdb.com/title/tt1093842/,Movie,7.5,80,2007,"Comedy, Drama, Fantasy, History",5872,2008-07-04,"Guy Maddin",,
875,tt0035169,2019-12-05,2020-08-13,"New interview with writer and film historian James Harvey about director Preston Sturges New interview with actor and comedian Bill Hader about Sturges Safeguarding Military Information, a 1941 World War II propaganda short written by Sturges Screen Guild Theater radio adaptation of the film from March 1943","The Palm Beach Story","The Palm Beach Story",https://www.imdb.com/title/tt0035169/,Movie,7.4,88,1942,"Comedy, Romance",13500,1943-01-01,"Preston Sturges",,
876,tt0240419,2019-12-05,2020-08-13,"New interview with Martel New interview with filmmaker Andrés Di Tella about Martel and the film Trailer","The Swamp","La Ciénaga",https://www.imdb.com/title/tt0240419/,Movie,7.0,103,2001,"Comedy, Drama",8692,2001-04-12,"Lucrecia Martel",,
877,tt0079854,2019-12-05,2020-08-13,"Scénario de “Sauve qui peut (la vie)” (1979), a short video created by director Jean-Luc Godard to secure financing for Every Man for Himself New video essay by critic Colin MacCabe New interviews with actor Isabelle Huppert and producer Marin Karmitz Archival interviews with actor Nathalie Baye, cinematographers Renato Berta and William Lubtchansky, and composer Gabriel Yared Two back-to-back 1980 appearances by Godard on The Dick Cavett Show Godard 1980, a short film by Jon Jost, Donald Ranvaud, and Peter Wollen, featuring Godard Trailer ","Every Man for Himself","Sauve qui peut (la vie)",https://www.imdb.com/title/tt0079854/,Movie,6.5,87,1980,"Drama",4166,1980-10-15,"Jean-Luc Godard",,
878,tt0069995,2019-12-05,2020-08-13,"New conversation between editor Graeme Clifford and film writer and historian Bobbie O’Steen “Don’t Look Now,” Looking Back, a short 2002 documentary featuring Roeg, Clifford, and cinematographer Anthony Richmond Death in Venice, a 2006 interview with composer Pino Donaggio Something Interesting, a new piece on the writing and making of the film, featuring recent interviews with Richmond, actors Julie Christie and Donald Sutherland, and coscreenwriter Allan Scott Nicolas Roeg: The Enigma of Film, a new piece on Roeg’s style, featuring recent interviews with filmmakers Danny Boyle and Steven Soderbergh Q&A with Roeg from 2003 at London’s Ciné Lumière Trailer","Don't Look Now","Don't Look Now",https://www.imdb.com/title/tt0069995/,Movie,7.1,110,1973,"Drama, Horror, Mystery, Thriller",66687,1974-01,"Nicolas Roeg",,
879,tt0028445,2019-12-05,2020-08-13,"Introduction by director Jean Renoir from 1962 The Road to “A Day in the Country,” a new interview with Renoir scholar Christopher Faulkner about the film’s production Renoir at Work, a new video essay by Faulkner on Renoir’s methods Un tournage à la campagne, an eighty-nine-minute 1994 compilation of outtakes from the film Interview with producer Pierre Braunberger from 1979 Screen tests ","A Day in the Country","Partie de campagne",https://www.imdb.com/title/tt0028445/,Short,7.5,40,1946,"Short, Comedy, Drama, Romance",7507,1950-12-12,"Jean Renoir",,
880,tt0064940,2019-12-05,2020-08-13,"Audio Commentary featuring an adaptation of Eileen Lanouette Hughes' memoir On the Set of Fellini Satyricon: A Behind-the-Scenes Diary Ciao, Federico!, Gideon Bachmann’s hour-long documentary shot on the set of Fellini Satyricon Archival interviews with director Federico Fellini New interview with Rotunno New documentary about Fellini’s adaptation of Petronius’s work, featuring interviews with classicists Luca Canali, a consultant on the film, and Joanna Paul New interview with photographer Mary Ellen Mark about her experiences on the set and her iconic photographs of Fellini and his film Felliniana, a presentation of Fellini Satyricon ephemera from the collection of Don Young Trailer  ","Fellini - Satyricon","Fellini - Satyricon",https://www.imdb.com/title/tt0064940/,Movie,6.8,129,1969,"Drama, Fantasy",17807,1970-03-11,"Federico Fellini",,
881,tt0078480,2019-12-05,2020-08-13,"New interview with director Martin Rosen New interview with filmmaker Guillermo del Toro about the film’s importance in animation history Four film-to-storyboard scene comparisons Defining a Style, a 2005 featurette about the film’s aesthetic Trailer ","Watership Down","Watership Down",https://www.imdb.com/title/tt0078480/,Movie,7.5,92,1978,"Animation, Adventure, Drama, Thriller",41864,1978-11-01,"Martin Rosen, John Hubley",,
882,tt0058458,2019-12-05,2020-08-13,"Audio Commentary by screenwriter Jean-Louis Richard and François Truffaut scholar Serge Toubiana New video essay by filmmaker and critic Kent Jones Monsieur Truffaut Meets Mr. Hitchcock, a 1999 documentary by film historian Robert Fischer Interview with Truffaut from 1965 about the film","The Soft Skin","La peau douce",https://www.imdb.com/title/tt0058458/,Movie,7.5,113,1964,"Drama, Romance",8848,1964-04-20,"François Truffaut",,
883,tt0039768,2019-12-05,2020-08-13,"Audio Commentary by film noir historians Alain Silver and James Ursini New interview with Imogen Sara Smith, author of In Lonely Places: Film Noir Beyond the City Lux Radio Theatre adaptation of the film from 1947, featuring Robert Montgomery, Wanda Hendrix, and Thomas Gomez ","Ride the Pink Horse","Ride the Pink Horse",https://www.imdb.com/title/tt0039768/,Movie,7.2,101,1947,"Drama, Film-Noir, Mystery, Thriller",3661,1948-02-02,"Robert Montgomery",,
884,tt0077598,2019-12-05,2020-08-13,"Two new interviews with Morris Werner Herzog Eats His Shoe (1980), a twenty-minute film by Les Blank featuring Herzog fulfilling a bet intended to inspire Morris to complete his first feature Footage of Herzog professing his admiration for Gates of Heaven at the 1980 Telluride Film Festival","Gates of Heaven","Gates of Heaven",https://www.imdb.com/title/tt0077598/,Movie,7.3,85,1978,"Documentary",6524,1978-10,"Errol Morris",,
885,tt0083281,2019-12-05,2020-08-13,"Two new interviews with Morris Werner Herzog Eats His Shoe (1980), a twenty-minute film by Les Blank featuring Herzog fulfilling a bet intended to inspire Morris to complete his first feature Footage of Herzog professing his admiration for Gates of Heaven at the 1980 Telluride Film Festival ","Vernon, Florida","Vernon, Florida",https://www.imdb.com/title/tt0083281/,Movie,7.0,55,1981,"Documentary",3796,1981,"Errol Morris",,
886,tt0096257,2019-12-05,2020-08-13,"New interview with Morris New interview with Joshua Oppenheimer, director of The Act of Killing NBC report from 1989 covering Randall Adams’s release from prison ","The Thin Blue Line","The Thin Blue Line",https://www.imdb.com/title/tt0096257/,Movie,7.9,101,1988,"Documentary, Crime",27123,1988-08-25,"Errol Morris",,
887,tt0039677,2019-12-05,2020-08-13,"New interview with British cinema scholar John Hill, author of Cinema and Northern Ireland: Film, Culture and Politics Postwar Poetry, a new short documentary about the film New interview with music scholar Jeff Smith about composer William Alwyn and his score Home, James, a 1972 documentary featuring actor James Mason revisiting his hometown Radio adaptation of the film from 1952, starring Mason and Dan O’Herlihy ","Odd Man Out","Odd Man Out",https://www.imdb.com/title/tt0039677/,Movie,7.6,116,1947,"Crime, Drama, Film-Noir, Thriller",12403,1947-04-23,"Carol Reed",,
888,tt0039822,2019-12-05,2020-08-13,"The short 24 Hours in the Life of a Clown (1946), director Jean-Pierre Melville’s first film New interview with film scholar Ginette Vincendeau Code Name Melville (2008), a seventy-six-minute documentary on Melville’s time in the French Resistance and his films about it Melville Steps Out of the Shadows (2010), a forty-two-minute documentary about Le silence de la mer Interview with Melville from 1959 ","The Silence of the Sea","Le silence de la mer",https://www.imdb.com/title/tt0039822/,Movie,7.6,87,1949,"Drama, Romance, War",6008,1949-04-22,"Jean-Pierre Melville",,
889,tt0044837,2019-12-05,2020-08-13,"Chaplin’s “Limelight”: Its Evolution and Intimacy, a new video essay by Charlie Chaplin biographer David Robinson New interviews with actors Claire Bloom and Norman Lloyd Chaplin Today: “Limelight,” a 2002 documentary on the film Archival audio recording of Chaplin reading two short excerpts from his novella Footlights Two short films by Chaplin: A Night in the Show (1915) and the uncompleted The Professor (1919) Outtake and two trailers ","Limelight","Limelight",https://www.imdb.com/title/tt0044837/,Movie,8.0,137,1952,"Drama, Music, Romance",23322,1952-10-31,"Charles Chaplin",,
890,tt0079826,2019-12-05,2020-08-13,"Audio Commentary by director Mark Rydell New interview with actor Bette Midler New conversation between Rydell and film historian and filmmaker Charles Dennis New conversation between Zsigmond and cinematographer John Bailey Archival interviews with Midler and Rydell, with on-set footage ","The Rose","The Rose",https://www.imdb.com/title/tt0079826/,Movie,7.0,125,1979,"Drama, Music, Romance",9639,1979-11-07,"Mark Rydell",,
891,tt0067227,2019-12-05,2020-08-13,"Audio Commentary by filmmaker Wim Wenders New interviews with actors Irm Hermann and Hans Hirschmüller New interview with film scholar Eric Rentschler ","The Merchant of Four Seasons","Händler der vier Jahreszeiten",https://www.imdb.com/title/tt0067227/,Movie,7.3,88,1972,"Drama",5533,1972-02-10,"Rainer Werner Fassbinder",,
892,tt0065439,2019-12-05,2020-08-13,"You Speak of Prague: The Second Trial of Artur London, a 1970 on-set documentary by set photographer Chris Marker, featuring Costa-Gavras, source book coauthor Artur London, actors Yves Montand and Simone Signoret, and screenwriter Jorge Semprún Portrait London, a 1981 French program featuring Artur and Lise London discussing their experiences as political prisoners Interview with Montand from 1970 New interview with editor Françoise Bonnot One-hour conversation between Costa-Gavras and film scholar Peter von Bagh from 1998 New interview with John Michalczyk, author of Costa-Gavras: The Political Fiction Film ","The Confession","L'aveu",https://www.imdb.com/title/tt0065439/,Movie,7.8,139,1970,"Drama, Thriller",5126,1970-12-09,"Costa-Gavras",,
893,tt0070959,2019-12-05,2020-08-13,"New conversation between Costa-Gavras and film scholar Peter Cowie NBC News excerpts from 1970 on the kidnapping of Dan A. Mitrione, on which the film is based ","State of Siege","État de siège",https://www.imdb.com/title/tt0070959/,Movie,7.7,120,1972,"Crime, Drama, Mystery, Thriller",6478,1973-02-08,"Costa-Gavras",,
894,tt0066516,2019-12-05,2020-08-13,"Three early shorts by director Jaromil Jireš: Uncle (1959), Footprints (1960), and The Hall of Lost Footsteps (1960) New interview with Czechoslovak film scholar Peter Hames Interviews from 2006 with actors Jaroslava Schallerová and Jan Klusák Alternate 2007 psych-folk soundtrack to the film by the Valerie Project, with a new video piece on the music’s origins ","Valerie and Her Week of Wonders","Valerie a týden divu",https://www.imdb.com/title/tt0066516/,Movie,7.0,77,1970,"Adventure, Drama, Fantasy, Horror",12492,1970-10-16,"Jaromil Jires",,
895,tt2276069,2019-12-05,2020-08-13,"New interview with director Jonathan Demme, stage director–actor André Gregory, and writer-actor Wallace Shawn, conducted by film critic David Edelstein New conversation between actors Julie Hagerty and Lisa Joyce New program featuring Gregory, Shawn, and their friend the author Fran Lebowitz in conversation Trailer ","A Master Builder","A Master Builder",https://www.imdb.com/title/tt2276069/,Movie,5.9,130,2013,"Drama",1154,2014-06-22,"Jonathan Demme",,
896,tt0052654,2019-12-05,2020-08-13,"New interview with writer Gregor Dorfmeister, on whose autobiographical novel the film is based New interview with filmmaker Volker Schlöndorff about the film’s impact on German cinema Interview from 1989 with director Bernhard Wicki Excerpt from a 2007 documentary by Elisabeth Wicki-Endriss, Wicki’s widow, featuring behind-the-scenes footage from the shoot ","The Bridge","Die Brücke",https://www.imdb.com/title/tt0052654/,Movie,7.9,103,1959,"Drama, History, War",9057,1961-05-01,"Bernhard Wicki",,
897,tt0101889,2019-12-05,2020-08-13,"Audio Commentary by director Terry Gilliam New interviews with Gilliam, producer Lynda Obst, screenwriter Richard La Gravenese, and actors Jeff Bridges, Amanda Plummer, and Mercedes Ruehl New interviews with artists Keith Greco and Vincent Jefferds on the creation of the film’s Red Knight Interview from 2006 with actor Robin Williams New video essay featuring Bridges’s on-set photographs Footage from 1991 of Bridges training as a radio personality with acting coach Stephen Bridgewater Deleted scenes, with audio commentary by Gilliam Costume tests Trailers","The Fisher King","The Fisher King",https://www.imdb.com/title/tt0101889/,Movie,7.5,137,1991,"Comedy, Drama, Fantasy",94420,1991-09-27,"Terry Gilliam",,
898,tt0078872,2019-12-05,2020-08-13,"Five short films by director Carroll Ballard, with new introductions by the filmmaker: Pigs! (1965), The Perils of Priscilla (1969), Rodeo (1969), Seems Like Only Yesterday (1971), and Crystallization (1974) New conversation between Ballard and film critic Scott Foundas New interview with Deschanel New piece featuring Mary Ellen Mark discussing her photographs from the film’s set Trailer","The Black Stallion","The Black Stallion",https://www.imdb.com/title/tt0078872/,Movie,7.4,118,1979,"Adventure, Family, Sport",14844,1979-10-17,"Carroll Ballard",,
899,tt0060529,2019-12-05,2020-08-13,"New introduction by filmmaker Mike Leigh New conversation between director Jan Troell and film historian Peter Cowie New interviews with actor Eddie Axberg and producer and coscreenwriter Bengt Forslund Interlude in the Marshland, a 1965 short film by Troell, starring Max von Sydow","Here Is Your Life","Här har du ditt liv",https://www.imdb.com/title/tt0060529/,Movie,7.3,110,1966,"Drama",1339,1968-12-20,"Jan Troell",,
900,tt0091578,2019-12-05,2020-08-13,"New conversation between director Stephen Frears and producer Colin MacCabe New interviews with writer Hanif Kureishi, producers Tim Bevan and Sarah Radclyffe, and Stapleton Trailer ","My Beautiful Laundrette","My Beautiful Laundrette",https://www.imdb.com/title/tt0091578/,Movie,6.8,97,1985,"Comedy, Drama, Romance",18153,1986-04-04,"Stephen Frears",,
901,tt0082416,2019-12-05,2020-08-13,"New interviews with actors Jeremy Irons and Meryl Streep, editor John Bloom, and composer Carl Davis New interview with film scholar Ian Christie Episode of The South Bank Show from 1981 featuring director Karel Reisz, novelist John Fowles, and screenwriter Harold Pinter Trailer","The French Lieutenant's Woman","The French Lieutenant's Woman",https://www.imdb.com/title/tt0082416/,Movie,6.9,124,1981,"Drama, Romance",16210,1981-10-16,"Karel Reisz",,
902,tt0070460,2019-12-05,2020-08-13,"New visual essay by filmmaker :: kogonada New interviews with Glenn and assistant editor Martine Barraqué New interview with film scholar Dudley Andrew Documentary on the film from 2003, featuring film scholar Annette Insdorf Archival interviews with director François Truffaut, editor Yann Dedet, and actors Jean-Pierre Aumont, Nathalie Baye, Jacqueline Bisset, Dani, and Bernard Menez Archival television footage about the film, including footage of Truffaut on the set Trailer","Day for Night","La nuit américaine",https://www.imdb.com/title/tt0070460/,Movie,8.0,116,1973,"Comedy, Drama, Romance",25736,1973-09-07,"François Truffaut",,
903,tt0080661,2019-12-05,2020-08-13,"New conversation between De Palma and filmmaker Noah Baumbach New interviews with actor Nancy Allen, producer George Litto, composer Pino Donaggio, shower-scene body double Victoria Lynn Johnson, and poster photographic art director Stephen Sayadian The Making of “Dressed to Kill,” a 2001 documentary New profile of cinematographer Ralf Bode, featuring filmmaker Michael Apted Interview with actor-director Keith Gordon from 2001 Pieces from 2001 about the different versions of the film and the cuts made to avoid an X rating Gallery of storyboards by De Palma Trailer ","Dressed to Kill","Dressed to Kill",https://www.imdb.com/title/tt0080661/,Movie,7.1,104,1980,"Crime, Drama, Mystery, Thriller",53395,1980-07-25,"Brian De Palma",,
904,tt2737050,2019-12-05,2020-08-13,"New interviews with the Dardennes and actors Marion Cotillard and Fabrizio Rongione When Léon M.’s Boat Went Down the Meuse for the First Time (1979), a forty-minute documentary by the Dardennes, featuring a new introduction by the directors New tour of the film’s key locations with the directors To Be an I, a new video essay by critic Kent Jones Trailer ","Two Days, One Night","Deux jours, une nuit",https://www.imdb.com/title/tt2737050/,Movie,7.3,95,2014,"Drama",51614,2014-05-21,"Jean-Pierre Dardenne, Luc Dardenne",,
905,tt0084549,2019-12-05,2020-08-13,"New interview with Polish film critic Tadeusz Sobolewski Interview with filmmaker Agnieszka Holland from 2003 Nine sections from the film originally censored in Poland","Blind Chance","Przypadek",https://www.imdb.com/title/tt0084549/,Movie,7.7,114,1987,"Drama, Romance",11904,1987-01-10,"Krzysztof Kieslowski",,
906,tt0080310,2019-12-05,2020-08-13,"Audio Commentary by director Bruce Beresford New interviews with Beresford, cinematographer Donald McAlpine, and actor Bryan Brown Interview with actor Edward Woodward from 2004 New piece about the Boer War with historian Stephen Miller The Breaker, a 1973 documentary profiling the real Harry “Breaker” Morant, with a 2010 statement by its director, Frank Shields Trailer ","Breaker Morant","'Breaker' Morant",https://www.imdb.com/title/tt0080310/,Movie,7.8,107,1980,"Drama, History, War",15075,1980-07-03,"Bruce Beresford",,
907,tt0102458,2019-12-05,2020-08-13,"New interviews with Beresford, producer Michael Fitzgerald, and actors Maynard Eziashi and Pierce Brosnan Trailer","Mister Johnson","Mister Johnson",https://www.imdb.com/title/tt0102458/,Movie,6.4,101,1990,"Drama",1301,1991-04,"Bruce Beresford",,
908,tt0091867,2019-12-05,2020-08-13,"New interviews with Ivory, Pierce-Roberts, costume designer John Bright, and actors Helena Bonham Carter, Simon Callow, and Julian Sands Segment about Merchant Ivory Productions from a 1987 episode of NBC Nightly News Trailer","A Room with a View","A Room with a View",https://www.imdb.com/title/tt0091867/,Movie,7.2,117,1985,"Drama, Romance",50722,1986-04-11,"James Ivory",,
909,tt1748122,2019-12-05,2020-08-13,"Audio Commentary by Wes Anderson, Bill Murray, Edward Norton, Jason Schwartzman, and Roman Coppola Selected-scene storyboard animatics Interviews with cast and crew Exploring the Set of “Moonrise Kingdom,” an original documentary about the film Norton’s home movies from the set Behind-the-scenes, special effects, and test footage Auditions Trailer","Moonrise Kingdom","Moonrise Kingdom",https://www.imdb.com/title/tt1748122/,Movie,7.8,94,2012,"Adventure, Comedy, Drama, Fantasy, Romance",376711,2012-06-29,"Wes Anderson",,
910,tt0078908,2019-12-05,2020-08-13,"New documentary about the making of the film and Cronenberg’s early work, featuring actor Samantha Eggar, executive producer Pierre David, cinematographer Mark Irwin, assistant director John Board, and special makeup effects artists Rick Baker (Videodrome) and Joe Blasco (Shivers, Rabid) New, restored 4K digital transfer of Cronenberg’s 1970 feature Crimes of the Future, supervised by the director, plus a 2011 interview with Cronenberg about his early career Interview from 2013 with actors Art Hindle and Cindy Hinds Appearance by actor Oliver Reed on The Merv Griffin Show from 1980 Radio spot ","The Brood","The Brood",https://www.imdb.com/title/tt0078908/,Movie,6.8,92,1979,"Horror, Sci-Fi",36678,1979-05-25,"David Cronenberg",,
