Position,Const,Created,Modified,Description,Title,Original Title,URL,Title Type,IMDb Rating,Runtime (mins),Year,Genres,Num Votes,Release Date,Directors,Your Rating,Date Rated
1218,tt0100332,2019-12-06,2020-08-14,"Audio Commentary by Jennie Livingston, ball community members Freddie Pendavis and Will Ninja, and film editor Jonathan Oppenheim New conversation between Livingston, ball community members Sol Pendavis and Freddie Pendavis, and filmmaker Thomas Allen Harris Over an hour of never-before-seen outtakes Episode of The Joan Rivers Show from 1991, featuring Livingston and ball community members Dorian Corey, Pepper LaBeija, Freddie Pendavis, and Willi Ninja Trailer","Paris Is Burning","Paris Is Burning",https://www.imdb.com/title/tt0100332/,Movie,8.2,78,1990,"Documentary",19876,1991-08,"Jennie Livingston",,
1219,tt0215545,2019-12-17,2020-08-14,"Audio Commentary by director Spike Lee New conversation between Lee and film programmer and critic Ashley Clark New interviews with choreographer and actor Savion Glover, actor Tommy Davidson, and costume designer Ruth E. Carter On Blackface and the Minstrel Show, a new interview program featuring film and media scholar Racquel Gates The Making of “Bamboozled” (2001), a documentary featuring members of the cast and crew Deleted scenes, music videos for the Mau Maus’ “Blak Iz Blak” and Gerald Levert’s “Dream with No Love,” and alternate parody commercials created for the film Poster gallery and trailer","Bamboozled","Bamboozled",https://www.imdb.com/title/tt0215545/,Movie,6.7,135,2000,"Comedy, Drama, Music",12804,2000-10-20,"Spike Lee",,
1220,tt0037865,2019-12-17,2020-08-14,"New interview with critic Imogen Sara Smith Trailer","Leave Her to Heaven","Leave Her to Heaven",https://www.imdb.com/title/tt0037865/,Movie,7.6,110,1945,"Drama, Film-Noir, Romance, Thriller",15944,1946-01,"John M. Stahl",,
1221,tt0028249,2019-12-17,2020-08-14,"Audio Commentary by American-musical historian Miles Kreuger New interview with James Whale biographer James Curtis Recognizing Race in “Show Boat,” a new interview program featuring professor and author Shana L. Redmond Paul Robeson: Tribute to an Artist (1979), an Academy Award–winning short documentary by Saul J. Turell, newly restored Two performances from the sound prologue of the 1929 film version of Show Boat, plus twenty minutes of silent excerpts from the film, with audio commentary by Kreuger Two radio adaptations of Show Boat, featuring stage and screen cast members Allan Jones, Helen Morgan, and Charles Winninger; actor Orson Welles; and novelist Edna Ferber","Show Boat","Show Boat",https://www.imdb.com/title/tt0028249/,Movie,7.4,113,1936,"Comedy, Drama, Musical, Romance",3904,1936-05-17,"James Whale",,
1222,tt0102713,2019-12-17,2020-08-14,"Audio Commentary by Barbra Streisand Making-of featurette from 1991 Excerpt from a 2018 interview with Streisand, conducted by filmmaker Robert Rodriguez on El Rey Network’s The Director’s Chair Audition and rehearsal footage Deleted scenes and alternate takes Costume and makeup tests Alternate end credits with vocal performance by Streisand Behind-the-scenes footage Gag reel Production-stills gallery and other archival materials Interview with author Pat Conroy from a 1992 episode of Cinema Showcase with Jim Whaley Interview with Streisand from a 1992 episode of the British television show Aspel & Company with Michael Aspel Trailers ","The Prince of Tides","The Prince of Tides",https://www.imdb.com/title/tt0102713/,Movie,6.8,132,1991,"Drama, Romance",20768,1991-12-25,"Barbra Streisand",,
1223,tt0063633,2020-01-17,2020-08-14,"High-definition digital transfer of The Junk Shop, director Juraj Herz’s 1965 debut short film Short documentary from 2011 featuring Herz visiting filming locations and recalling the production of The Cremator New interview with film programmer Irena Kovarova about the style of the film Documentary from 2017 about composer Zdeněk Liška featuring Herz, filmmakers Jan Švankmajer and the Quay Brothers, and others Interview with actor Rudolf Hrušínský from 1993 Trailer","The Cremator","Spalovac mrtvol",https://www.imdb.com/title/tt0063633/,Movie,8.0,95,1969,"Comedy, Crime, Drama, Horror, Mystery",12072,1969-03-14,"Juraj Herz",,
1224,tt0031225,2020-01-17,2020-08-14,"New interview with critic Imogen Sara Smith New interview with Donald Dewey, author of James Stewart: A Biography New video essay featuring excerpts from a 1973 oral-history interview with director George Marshall, conducted by the American Film Institute Lux Radio Theatre adaptation of the film from 1945, featuring actors James Stewart and Joan Blondell","Destry Rides Again","Destry Rides Again",https://www.imdb.com/title/tt0031225/,Movie,7.6,95,1939,"Comedy, Western",13128,1939-12-29,"George Marshall",,
1225,tt2278388,2020-01-17,2020-08-14,"Audio Commentary by director Wes Anderson, filmmaker Roman Coppola, and actor Jeff Goldblum Selected-scene storyboard animatics The Making of “The Grand Budapest Hotel,” a new documentary about the film New interviews with the cast and crew Video essays from 2015 and 2020 by critic Matt Zoller Seitz and film scholar David Bordwell Behind-the-scenes, special-effects, and test footage Trailer","The Grand Budapest Hotel","The Grand Budapest Hotel",https://www.imdb.com/title/tt2278388/,Movie,8.1,99,2014,"Comedy, Drama",934370,2014-03-28,"Wes Anderson",,
1226,tt0415978,2020-01-17,2020-08-14,"New documentary about July’s artistic beginnings and the development of her debut feature Open to the World, a new documentary by July about the 2017 interfaith charity shop and participatory artwork she created in collaboration with Artangel July Interviews July: Deauville, 2005, a discovery from July’s archives, newly edited Six scenes from the 2003 Sundance Directors Lab, where July workshopped the film, with commentary by July The Amateurist (1998) and Nest of Tens (2000), short films by July Several films from July’s Joanie 4 Jackie project, and a documentary about the program Trailer ","Me and You and Everyone We Know","Me and You and Everyone We Know",https://www.imdb.com/title/tt0415978/,Movie,7.2,85,2005,"Comedy, Drama",38191,2005-08-05,"Miranda July",,
1227,tt0057115,2020-02-15,2020-08-14,"Audio Commentary by director John Sturges and composer Elmer Bernstein Audio Commentary by actors James Coburn, James Garner, and Donald Pleasance New interview with critic Michael Sragow “The Great Escape”: Heroes Underground, a four-part 2001 documentary about the real-life escape from the Stalag Luft III prisoner-of-war camp during World War II, including interviews with POWs held there The Real Virgil Hilts: A Man Called Jones, a 2001 program on the United States Army Air Forces pilot David Jones, the inspiration for Steve McQueen’s character in the film Return to “The Great Escape,” a 1993 program featuring interviews with Coburn, Garner, actors David McCallum and Jud Taylor, stuntman Bud Ekins, and McQueen’s son, Chad McQueen Trailer","The Great Escape","The Great Escape",https://www.imdb.com/title/tt0057115/,Movie,8.2,172,1963,"Adventure, Drama, Thriller, War",270716,1963-07-04,"John Sturges",,
1228,tt0032376,2020-02-15,2020-08-14,"Selected-scene Audio Commentary by film historian Cari Beauchamp New introduction by critic B. Ruby Rich New interview with filmmaker Francis Ford Coppola","Dance, Girl, Dance","Dance, Girl, Dance",https://www.imdb.com/title/tt0032376/,Movie,6.8,90,1940,"Comedy, Drama, Music",3348,1940-08-30,"Dorothy Arzner, Roy Del Ruth",,
1229,tt0065867,2020-02-15,2020-08-14,"Audio Commentary by film critic Marshall Fine New interviews with producer Al Ruban and actor Jenny Runacre New video essay by filmmaker Daniel Raim, featuring audio recordings of John Cassavetes in his own words, exploring the actor-director’s spirited approach to acting The Story of “Husbands”—A Tribute to John Cassavetes (2009), a half-hour program featuring Ruban, actor Ben Gazzara, and cinematographer Victor J. Kemper Episode of The Dick Cavett Show from 1970 featuring Cassavetes, Gazzara, and actor Peter Falk Trailer","Husbands","Husbands",https://www.imdb.com/title/tt0065867/,Movie,7.1,154,1970,"Comedy, Drama",7847,1970-12-08,"John Cassavetes",,
1230,tt0057680,2020-02-15,2020-08-14,"New conversation between director Martin Scorsese and film critic Farran Smith Nehme New discussion among filmmakers Ari Aster and Josh and Benny Safdie More!","What's a Nice Girl Like You Doing in a Place Like This?","What's a Nice Girl Like You Doing in a Place Like This?",https://www.imdb.com/title/tt0057680/,Short,6.4,10,1963,"Short, Comedy, Drama",2892,1963,"Martin Scorsese",,
1231,tt0058242,2020-02-15,2020-08-14,"New conversation between director Martin Scorsese and film critic Farran Smith Nehme New discussion among filmmakers Ari Aster and Josh and Benny Safdie More! ","It's Not Just You, Murray!","It's Not Just You, Murray!",https://www.imdb.com/title/tt0058242/,Short,6.4,16,1964,"Short, Comedy, Crime, Drama",2400,1964-02,"Martin Scorsese",,
1232,tt0061402,2020-02-15,2020-08-14,"New conversation between director Martin Scorsese and film critic Farran Smith Nehme New discussion among filmmakers Ari Aster and Josh and Benny Safdie More!","The Big Shave","The Big Shave",https://www.imdb.com/title/tt0061402/,Short,7.0,5,1967,"Short, Drama, Horror",9485,1968-10,"Martin Scorsese",,
1233,tt0071680,2020-02-15,2020-08-14,"New conversation between director Martin Scorsese and film critic Farran Smith Nehme New discussion among filmmakers Ari Aster and Josh and Benny Safdie More!","Italianamerican","Italianamerican",https://www.imdb.com/title/tt0071680/,Movie,7.6,49,1974,"Documentary",4054,1980-04-16,"Martin Scorsese",,
1234,tt0077157,2020-02-15,2020-08-14,"New conversation between director Martin Scorsese and film critic Farran Smith Nehme New discussion among filmmakers Ari Aster and Josh and Benny Safdie More!","American Boy: A Profile of Steven Prince","American Boy: A Profile of - Steven Prince",https://www.imdb.com/title/tt0077157/,Movie,7.3,55,1978,"Documentary",2066,1978-10,"Martin Scorsese",,
1235,tt5929754,2020-02-15,2020-08-14,"New interviews with director Paul Dano, screenwriter Zoe Kazan, actors Carey Mulligan and Jake Gyllenhaal, cinematographer Diego García, production designer Akin McKenzie, and costume designer Amanda Ford New conversation on the film’s postproduction with Dano, editor Matthew Hannam, and composer David Lang Film at Lincoln Center conversation from 2018 between Dano and novelist Richard Ford about the film’s source material","Wildlife","Wildlife",https://www.imdb.com/title/tt5929754/,Movie,6.8,105,2018,"Drama",32618,2019-01-01,"Paul Dano",,
1236,tt0078444,2020-03-19,2020-08-14,"Audio Commentary by director Paul Mazursky and actress Jill Clayburgh New interviews with actors Michael Murphy and Lisa Lucas New interview with author Sam Wasson on Mazursky’s work Audio recording of Mazursky speaking at the American Film Institute in 1980 Trailer","An Unmarried Woman","An Unmarried Woman",https://www.imdb.com/title/tt0078444/,Movie,7.2,124,1978,"Comedy, Drama, Romance",6511,1978-03-17,"Paul Mazursky",,
1237,tt0018742,2020-03-19,2020-08-14,"Audio Commentary by Glenn Mitchell, author of A-Z of Silent Film Comedy: An Illustrated Companion Spite Marriage (1929), Buster Keaton’s next feature for MGM following The Cameraman, in a new 2K restoration, with a 2004 commentary by film historians John Bengtson and Jeffrey Vance Time Travelers, a new documentary by Daniel Raim featuring interviews with Bengtson and film historian Marc Wanamaker So Funny It Hurt: Buster Keaton & MGM, a 2004 documentary by film historians Kevin Brownlow and Christopher Bird New interview with James L. Neibaur, author of The Fall of Buster Keaton: His Films for MGM, Educational Pictures, and Columbia","The Cameraman","The Cameraman",https://www.imdb.com/title/tt0018742/,Movie,8.0,76,1928,"Comedy, Drama, Family, Romance",14032,1928-09-22,"Edward Sedgwick, Buster Keaton",,
1238,tt8613070,2020-03-19,2020-08-14,"New conversation between director Céline Sciamma and film critic Dana Stevens New interviews with actors Adèle Haenel and Noémie Merlant Interview with cinematographer Claire Mathon from the 2019 Cannes Film Festival Interview from 2019 with artist Hélène Delmaire on creating the paintings for the film, along with behind-the-scenes footage","Portrait of a Lady on Fire","Portrait de la jeune fille en feu",https://www.imdb.com/title/tt8613070/,Movie,8.0,122,2019,"Drama, Romance",120840,2020-02-14,"Céline Sciamma",,
1239,tt0091251,2020-03-19,2020-08-14,"New interview with cinematographer Roger Deakins New interview with director Elem Klimov’s brother and frequent collaborator German Klimov Flaming Memory, a three-film documentary series from 1975–77 by filmmaker Viktor Dashuk featuring firsthand accounts of survivors of the genocide in Belorussia during World War II Interview from 2001 with Elem Klimov Interviews from 2001 with actor Alexei Kravchenko and production designer Viktor Petrov How “Come and See” Was Filmed, a 1985 short film about the making of the film featuring interviews with Elem Klimov, Kravchenko, and writer Ales Adamovich Theatrical rerelease trailer","Come and See","Idi i smotri",https://www.imdb.com/title/tt0091251/,Movie,8.3,142,1985,"Drama, Thriller, War",114457,1985-09-03,"Elem Klimov",,
1240,tt0067824,2020-04-14,2020-08-14,"Audio Commentary by Bruce Lee expert Brandon Bentley Audio Commentary by Hong Kong-film expert Mike Leeder 4K digital restorations of The Big Boss, Fist of Fury, Game of Death, and The Way of the Dragon, with uncompressed original monaural soundtracks New interviews on all five films with Lee biographer Matthew Polly New interview with producer Andre Morgan about Golden Harvest, the company behind Hong Kong’s top martial-arts stars, including Lee New program about English-language dubbing with voice performers Michael Kaye (the English-speaking voice of Lee’s Chen Zhen in Fist of Fury) and Vaughan Savidge New interview with author Grady Hendrix about the “Bruceploitation” subgenre that followed Lee’s death, and a selection of Bruceploitation trailers Multiple programs and documentaries about Lee’s life and philosophies, including Bruce Lee: The Man and the Legend (1973) and Bruce Lee: In His Own Words (1998) Interviews with Linda Lee Cadwell, Lee’s widow, and many of Lee’s collaborators and admirers, including actors Jon T. Benn, Riki Hashimoto, Nora Miao, Robert Wall, Yuen Wah, and Simon Yam and directors Clarence Fok, Sammo Hung, and Wong Jing Promotional materials","The Big Boss","Tang shan da xiong",https://www.imdb.com/title/tt0067824/,Movie,6.9,99,1971,"Action, Crime, Drama, Thriller",30977,1972-10-05,"Wei Lo, Chia-Hsiang Wu",,
1241,tt0068767,2020-04-14,2020-08-14,"Audio Commentary by Hong Kong-film expert Mike Leeder 4K digital restorations of The Big Boss, Fist of Fury, Game of Death, and The Way of the Dragon, with uncompressed original monaural soundtracks New interviews on all five films with Lee biographer Matthew Polly New interview with producer Andre Morgan about Golden Harvest, the company behind Hong Kong’s top martial-arts stars, including Lee New program about English-language dubbing with voice performers Michael Kaye (the English-speaking voice of Lee’s Chen Zhen in Fist of Fury) and Vaughan Savidge New interview with author Grady Hendrix about the “Bruceploitation” subgenre that followed Lee’s death, and a selection of Bruceploitation trailers Multiple programs and documentaries about Lee’s life and philosophies, including Bruce Lee: The Man and the Legend (1973) and Bruce Lee: In His Own Words (1998) Interviews with Linda Lee Cadwell, Lee’s widow, and many of Lee’s collaborators and admirers, including actors Jon T. Benn, Riki Hashimoto, Nora Miao, Robert Wall, Yuen Wah, and Simon Yam and directors Clarence Fok, Sammo Hung, and Wong Jing Promotional materials","Fist of Fury","Jing wu men",https://www.imdb.com/title/tt0068767/,Movie,7.2,107,1972,"Action, Drama, Romance, Thriller",36034,1972-09-09,"Wei Lo",,
1242,tt0068935,2020-04-14,2020-08-14,"Audio Commentary by Hong Kong-film expert Mike Leeder 4K digital restorations of The Big Boss, Fist of Fury, Game of Death, and The Way of the Dragon, with uncompressed original monaural soundtracks New interviews on all five films with Lee biographer Matthew Polly New interview with producer Andre Morgan about Golden Harvest, the company behind Hong Kong’s top martial-arts stars, including Lee New program about English-language dubbing with voice performers Michael Kaye (the English-speaking voice of Lee’s Chen Zhen in Fist of Fury) and Vaughan Savidge New interview with author Grady Hendrix about the “Bruceploitation” subgenre that followed Lee’s death, and a selection of Bruceploitation trailers Multiple programs and documentaries about Lee’s life and philosophies, including Bruce Lee: The Man and the Legend (1973) and Bruce Lee: In His Own Words (1998) Interviews with Linda Lee Cadwell, Lee’s widow, and many of Lee’s collaborators and admirers, including actors Jon T. Benn, Riki Hashimoto, Nora Miao, Robert Wall, Yuen Wah, and Simon Yam and directors Clarence Fok, Sammo Hung, and Wong Jing Promotional materials","The Way of the Dragon","Meng long guo jiang",https://www.imdb.com/title/tt0068935/,Movie,7.1,90,1972,"Action, Adventure, Comedy, Crime, Drama, Thriller",43339,1973-09,"Bruce Lee",,
1243,tt0070034,2020-04-14,2020-08-14,"Audio Commentary by producer Paul Heller New 2K digital restoration of the rarely-seen 99-minute 1973 theatrical version of Enter the Dragon, with uncompressed original monaural soundtrack 2K digital restoration of the 102-minute “special-edition” version of Enter the Dragon Alternate audio soundtracks for the films, including original English-dubbed tracks and a 5.1 surround soundtrack for the special-edition version of Enter the Dragon New interviews on all five films with Lee biographer Matthew Polly New interview with producer Andre Morgan about Golden Harvest, the company behind Hong Kong’s top martial-arts stars, including Lee New program about English-language dubbing with voice performers Michael Kaye (the English-speaking voice of Lee’s Chen Zhen in Fist of Fury) and Vaughan Savidge New interview with author Grady Hendrix about the “Bruceploitation” subgenre that followed Lee’s death, and a selection of Bruceploitation trailers Blood and Steel, a 2004 documentary about the making of Enter the Dragon Multiple programs and documentaries about Lee’s life and philosophies, including Bruce Lee: The Man and the Legend (1973) and Bruce Lee: In His Own Words (1998) Interviews with Linda Lee Cadwell, Lee’s widow, and many of Lee’s collaborators and admirers, including actors Jon T. Benn, Riki Hashimoto, Nora Miao, Robert Wall, Yuen Wah, and Simon Yam and directors Clarence Fok, Sammo Hung, and Wong Jing Promotional materials","Enter the Dragon","Enter the Dragon",https://www.imdb.com/title/tt0070034/,Movie,7.6,102,1973,"Action, Crime, Thriller",117563,1973-08-19,"Robert Clouse",,
1244,tt0077594,2020-04-14,2020-08-14,"Audio Commentary by Hong Kong-film expert Mike Leeder 4K digital restorations of The Big Boss, Fist of Fury, Game of Death, and The Way of the Dragon, with uncompressed original monaural soundtracks High-definition presentation of Game of Death II, the 1981 sequel to Game of Death Game of Death Redux, a new presentation of Lee’s original Game of Death footage, produced by Alan Canvan New interviews on all five films with Lee biographer Matthew Polly New interview with producer Andre Morgan about Golden Harvest, the company behind Hong Kong’s top martial-arts stars, including Lee New program about English-language dubbing with voice performers Michael Kaye (the English-speaking voice of Lee’s Chen Zhen in Fist of Fury) and Vaughan Savidge New interview with author Grady Hendrix about the “Bruceploitation” subgenre that followed Lee’s death, and a selection of Bruceploitation trailers Multiple programs and documentaries about Lee’s life and philosophies, including Bruce Lee: The Man and the Legend (1973) and Bruce Lee: In His Own Words (1998) Interviews with Linda Lee Cadwell, Lee’s widow, and many of Lee’s collaborators and admirers, including actors Jon T. Benn, Riki Hashimoto, Nora Miao, Robert Wall, Yuen Wah, and Simon Yam and directors Clarence Fok, Sammo Hung, and Wong Jing Promotional materials","Game of Death","Game of Death",https://www.imdb.com/title/tt0077594/,Movie,5.9,100,1978,"Action, Crime, Drama, Thriller",23446,1979-06-08,"Robert Clouse, Bruce Lee",,
1245,tt0046534,2020-04-16,2020-08-14,"Audio Commentary by filmmaker Joe Dante, film historian Bob Burns, and author Bill Warren Movie Archaeologists, a new program on the visual and sound effects in the film featuring Burtt and film historian Craig Barron From the Archive, a new program about the film’s restoration featuring Barron, Burtt, and Paramount Pictures archivist Andrea Kalas Audio interview with producer George Pal from 1970 The Sky Is Falling, a 2005 documentary about the making of the film The Mercury Theatre on the Air radio adaptation of The War of the Worlds from 1938, directed and narrated by Orson Welles Radio program from 1940 featuring a discussion between Welles and H. G. Wells, author of the 1897 novel The War of the Worlds Trailer","The War of the Worlds","The War of the Worlds",https://www.imdb.com/title/tt0046534/,Movie,7.0,87,1953,"Action, Sci-Fi, Thriller",40333,1953-08-26,"Byron Haskin",,
1246,tt7653254,2020-04-16,2020-08-14,"New interview with Baumbach The Players, a new program featuring interviews with actors Scarlett Johansson, Adam Driver, Laura Dern, Alan Alda, Julie Hagerty, and Ray Liotta The Filmmakers, a new program about the production of the film, featuring interviews with Baumbach, editor Jennifer Lame, production designer Jade Healy, costume designer Mark Bridges, and producer David Heyman The Making of “Marriage Story,” a new program featuring behind-the-scenes footage New interviews with composer Randy Newman and Baumbach about the film’s score New program featuring Baumbach walking the viewer through a key location from the film Trailers","Marriage Story","Marriage Story",https://www.imdb.com/title/tt7653254/,Movie,7.9,137,2019,"Drama, Romance",362643,2019-12-06,"Noah Baumbach",,
1247,tt9530198,2020-05-16,2020-08-14,"Introductions by director Agnès Varda Nausicaa, a once-banned 1970 television film directed by Varda New programs featuring actor Jane Birkin; Varda’s children, Mathieu Demy and Rosalie Varda; and scholar Kelley Conway Segments directed by Varda from the 1983 French television program Une minute pour une image Programs on Varda’s work as a visual artist, including Quelques veuves de Noirmoutier, a 2006 television presentation of one of her installations Over seven hours of archival programs featuring Varda, many of them also directed by her Archival interviews and tributes featuring Varda’s friends, family, and key collaborators Rare footage from unfinished features and commercials Behind-the-scenes footage, video essays, and trailers","Varda by Agnès","Varda par Agnès",https://www.imdb.com/title/tt9530198/,TV Mini Series,7.8,60,2019,"Documentary, Biography",2726,2019-11-20,,,
1248,tt4998170,2020-05-16,2020-08-14,"Introductions by director Agnès Varda Nausicaa, a once-banned 1970 television film directed by Varda New programs featuring actor Jane Birkin; Varda’s children, Mathieu Demy and Rosalie Varda; and scholar Kelley Conway Segments directed by Varda from the 1983 French television program Une minute pour une image Programs on Varda’s work as a visual artist, including Quelques veuves de Noirmoutier, a 2006 television presentation of one of her installations Over seven hours of archival programs featuring Varda, many of them also directed by her Archival interviews and tributes featuring Varda’s friends, family, and key collaborators Rare footage from unfinished features and commercials Behind-the-scenes footage, video essays, and trailers","Les 3 boutons","Les 3 boutons",https://www.imdb.com/title/tt4998170/,Short,6.1,11,2015,"Short, Drama",513,2015-09-03,"Agnès Varda",,
1249,tt0050788,2020-05-16,2020-08-14,"Introductions by director Agnès Varda Nausicaa, a once-banned 1970 television film directed by Varda New programs featuring actor Jane Birkin; Varda’s children, Mathieu Demy and Rosalie Varda; and scholar Kelley Conway Segments directed by Varda from the 1983 French television program Une minute pour une image Programs on Varda’s work as a visual artist, including Quelques veuves de Noirmoutier, a 2006 television presentation of one of her installations Over seven hours of archival programs featuring Varda, many of them also directed by her Archival interviews and tributes featuring Varda’s friends, family, and key collaborators Rare footage from unfinished features and commercials Behind-the-scenes footage, video essays, and trailers","Ô saisons ô chateaux","Ô saisons ô chateaux",https://www.imdb.com/title/tt0050788/,Short,6.9,20,1958,"Documentary, Short",505,2019-12-24,"Agnès Varda",,
