Position,Const,Created,Modified,Description,Title,Original Title,URL,Title Type,IMDb Rating,Runtime (mins),Year,Genres,Num Votes,Release Date,Directors,Your Rating,Date Rated
441,tt0093389,2019-12-05,2020-08-11,"Audio Commentary by Bernardo Bertolucci, producer Jeremy Thomas, screenwriter Mark Peploe, and composer-actor Ryuichi Sakamoto The Italian Traveler: Bernardo Bertolucci, a 53-minute film by Fernand Moszkowicz tracing the director's geographic influences, from Parma to China Video images taken by Bertolucci while on preproduction in China The Chinese Adventure of Bernardo Bertolucci, a 52-minute documentary that revisits the film's making A new, 47-minute documentary featuring Storaro, editor Gabriella Cristiani, costume designer James Acheson, and art director Gianni Silvestri A 66-minute BBC documentary exploring Bertolucci's creative process and the making of The Last Emperor A 30-minute interview with Bertolucci from 1989 A new interview with composer David Byrne A new interview with Ian Buruma examining the historical period of the film Theatrical trailer","The Last Emperor","The Last Emperor",https://www.imdb.com/title/tt0093389/,Movie,7.7,163,1987,"Biography, Drama, History",116589,1988-04-15,"Bernardo Bertolucci",,
442,tt0096409,2019-12-05,2020-08-11,"Audio Commentary by Alex Cox and screenwriter Rudy Wurlitzer Dispatches from Nicaragua, an original documentary about the filming of Walker On Moviemaking and the Revolution, reminiscences twenty years later from an extra on the film The Immortals: behind-the-scenes photos","Walker","Walker",https://www.imdb.com/title/tt0096409/,Movie,6.6,94,1987,"Biography, Drama, History, Western",4611,1987-12-04,"Alex Cox",,
443,tt0056210,2019-12-05,2020-08-11,"A 1996 interview with director Alberto Lattuada by filmmaker Daniele Luchetti New interviews with the director's wife, actress Carla Del Poggio (Variety Lights), and son Alessandro Lattuada Trailers for the original Italian release and the 2007 U.S. rerelease Gallery of promotional caricatures by artist Keiko Kimura ","Mafioso","Mafioso",https://www.imdb.com/title/tt0056210/,Movie,7.6,105,1962,"Comedy, Crime, Drama",3172,1965-03-04,"Alberto Lattuada",,
444,tt0086907,2019-12-05,2020-08-11,"Interview with architect Arata Isozaki from 2008 Gaudí, Catalunya, 1959, footage from director Hiroshi Teshigahara’s first trip to Spain Visions of Space: “Antoni Gaudí,” an hour-long documentary from 2003 on the architect’s life and work BBC program on Gaudí by filmmaker Ken Russell Sculptures by Sofu—Vita, a 1963 short film by Teshigahara on the sculpture work of his father, Sofu Teshigahara Trailer ","Antonio Gaudí","Antonio Gaudí",https://www.imdb.com/title/tt0086907/,Movie,7.2,72,1984,"Documentary",1824,1986-03-05,"Hiroshi Teshigahara",,
445,tt0119349,2019-12-05,2020-08-11,"Audio Commentary by Ang Lee and producer-screenwriter James Schamus Documentary featuring interviews with actors Joan Allen, Kevin Kline, Tobey Maguire, Christina Ricci, Sigourney Weaver, and Elijah Wood Interview with novelist Rick Moody Deleted scenes Footage from a 2007 event honoring Lee and Schamus at New York’s Museum of the Moving Image Illustrated audio interviews with Elmes, production designer Mark Friedberg, and costume designer Carol Oditz Trailer ","The Ice Storm","The Ice Storm",https://www.imdb.com/title/tt0119349/,Movie,7.3,112,1997,"Drama",62407,1997-11-26,"Ang Lee",,
446,tt0048394,2019-12-05,2020-08-11,"Calle Bardem (2005), a documentary on the revolutionary life and career of director Juan Antonio Bardem","Death of a Cyclist","Muerte de un ciclista",https://www.imdb.com/title/tt0048394/,Movie,7.7,88,1955,"Crime, Drama",4720,1955-09-07,"Juan Antonio Bardem",,
447,tt0054687,2019-12-05,2020-08-11,"Requiem for a Killer: The Making of Blast of Silence Rare on-set Polaroids Locations revisited in 2008 Theatrical trailer","Blast of Silence","Blast of Silence",https://www.imdb.com/title/tt0054687/,Movie,7.4,77,1961,"Crime, Drama, Thriller",6135,1962-08-17,"Allen Baron",,
448,tt0052556,2019-12-05,2020-08-11,"Selection of archival interviews with Louis Malle, actors Jeanne Moreau and José Luis de Villalonga, and writer Louise de Vilmorin Gallery of promotional material from the U.S. theatrical release","The Lovers","Les amants",https://www.imdb.com/title/tt0052556/,Movie,7.1,90,1958,"Drama, Romance",6229,1959-10-26,"Louis Malle",,
449,tt0057058,2019-12-05,2020-08-11,"Archival interviews with director Louis Malle and actor Maurice Ronet Malle's Fire Within, a new video program featuring interviews with actor Alexandra Stewart and filmmakers Philippe Collin and Volker Schlöndorff Jusqu'au 23 Juillet, a 2005 documentary short about the film and its source novel Le feu follet, by Pierre Drieu la Rochelle, featuring actor Mathieu Amalric, writer Didier Daeninckx, and Cannes festival curator Pierre-Henri Deleau","The Fire Within","Le feu follet",https://www.imdb.com/title/tt0057058/,Movie,7.8,108,1963,"Drama",11151,1966-10-07,"Louis Malle",,
450,tt0033152,2019-12-05,2020-08-11,"Audio Commentary by Francis Ford Coppola and Martin Scorsese Audio Commentary by film and music historian Bruce Eder Visual Effects, a documentary about the technical achievements of The Thief of Bagdad, featuring interviews with special-effects masters Ray Harryhausen, Dennis Muren, and Craig Barron The Lion Has Wings (1940), Alexander Korda's propaganda film for the English war effort, created when The Thief of Bagdad went into production hiatus Excerpts from codirector Michael Powell's audio dictations for his autobiography Excerpts from a 1976 radio interview with composer Miklos Rózsa Stills gallery featuring rare images of the film's production and photos shot in Dufaycolor * Optional music and effects track Theatrical trailer","The Thief of Bagdad","The Thief of Bagdad",https://www.imdb.com/title/tt0033152/,Movie,7.4,106,1940,"Adventure, Family, Fantasy, Romance",15363,1940-12-25,"Ludwig Berger, Michael Powell, Tim Whelan, Alexander Korda, Zoltan Korda, William Cameron Menzies",,
451,tt0089603,2019-12-05,2020-08-11,"Audio Commentary by Paul Schrader and producer Alan Poul Interviews from 2007 and 2008 with Bailey, producers Tom Luddy and Mata Yamamoto, composer Philip Glass, and production designer Eiko Ishioka Interviews from 2008 with Yukio Mishima biographer John Nathan and friend Donald Richie Audio interview from 2008 with coscreenwriter Chieko Schrader Interview excerpt from 1966 featuring Mishima talking about writing The Strange Case of Yukio Mishima, a documentary from 1985 about the author Trailer photographs of Ishioka’s sets","Mishima: A Life in Four Chapters","Mishima: A Life in Four Chapters",https://www.imdb.com/title/tt0089603/,Movie,7.9,120,1985,"Biography, Drama",15684,1985-09-20,"Paul Schrader",,
452,tt0059936,2019-12-05,2020-08-11,"A 45-minute audio recording of Yukio Mishima speaking to the Foreign Correspondents' Association of Japan A 45-minute making-of documentary, featuring crew from the film's production Interview excerpts featuring Mishima discussing war and death","Patriotism","Yûkoku",https://www.imdb.com/title/tt0059936/,Short,7.4,30,1966,"Drama, Short",2200,1966-04-12,"Yukio Mishima",,
453,tt0052698,2019-12-05,2020-08-11,"Excerpts from Claude Sautet ou la magie invisible, a 2003 documentary on the director by writers N. T. Binh and Dominique Rabourdin Interview with Classe tous risques novelist and screenwriter José Giovanni Archival interview footage featuring actor Lino Ventura discussing his career Original French and U.S. release trailers","The Big Risk","Classe tous risques",https://www.imdb.com/title/tt0052698/,Movie,7.5,103,1960,"Crime, Drama, Romance, Thriller",4804,1960-04-01,"Claude Sautet",,
454,tt0042490,2019-12-05,2020-08-11,"Audio Commentary by film historian Jim Kitses (Horizons West) The Movies: Action Speaks Louder than Words, a 1967 television interview with director Anthony Mann A rare, 1931 on-camera interview with Walter Huston, made for the movie theater series Intimate Interviews New video interview with Nina Mann, daughter of Anthony Mann Stills gallery of rare behind-the-scenes photos Theatrical trailer","The Furies","The Furies",https://www.imdb.com/title/tt0042490/,Movie,7.2,109,1950,"Drama, Western",4167,1950-08-14,"Anthony Mann",,
455,tt0110882,2019-12-05,2020-08-11,"Audio Commentary by Milcho Manchevski and film scholar Annette Insdorf New video interview with actor Rade Šerbedžija Behind the Scenes in Macedonia, a short 1993 documentary about the making of Before the Rain Soundtrack selections, featuring the music of Macedonian band Anastasia On-set footage, theatrical trailers, and stills galleries of production photos, storyboards, and letters A selection from Manchevski's photography collection Street Manchevski's award-winning Tennessee music video","Before the Rain","Pred dozhdot",https://www.imdb.com/title/tt0110882/,Movie,7.8,113,1994,"Drama, Romance, War",16405,1995-02-24,"Milcho Manchevski",,
456,tt0023649,2019-12-05,2020-08-11,"Audio Commentary by film scholar Tony Rayns Carl Th. Dreyer, a 1966 documentary by Jørgen Roos chronicling Dreyer’s career Video essay by scholar Casper Tybjerg on Dreyer’s influences in creating Vampyr Radio broadcast from 1958 of Dreyer reading an essay about filmmaking","Vampyr","Vampyr",https://www.imdb.com/title/tt0023649/,Movie,7.4,75,1932,"Fantasy, Horror",21898,1934-08-14,"Carl Theodor Dreyer",,
457,tt0067439,2019-12-05,2020-08-11,"On-Screen: Mon oncle Antoine, a 2007 documentary tracing the making and history of the film Claude Jutra: An Unfinished Story, a 2002 documentary by Paule Baillargeon, featuring interviews with Brault, director Bernardo Bertolucci, and actors Geneviève Bujold and Saul Rubinek A Chairy Tale, a 1957 experimental short codirected by Jutra and Norman McLaren Theatrical trailer ","My Uncle Antoine","Mon oncle Antoine",https://www.imdb.com/title/tt0067439/,Movie,7.4,104,1971,"Drama",3324,1971-11-12,"Claude Jutra",,
458,tt0069400,2019-12-05,2020-08-11,"“Jacques Tati in Monsieur Hulot’s Work,” a 1976 episode of the British television program Omnibus featuring an interview with Tati about his Hulot films Trailer","Traffic","Trafic",https://www.imdb.com/title/tt0069400/,Movie,7.0,96,1971,"Comedy",8055,1972-12-11,"Jacques Tati",,
459,tt0443455,2019-12-05,2020-08-11,"Narration tracks by Isabella Rossellini, Laurie Anderson, John Ashbery, Guy Maddin, Louis Negin, and Eli Wallach 97 Percent True, a new documentary featuring interviews with the director and his collaborators Two new short films directed by Maddin exclusively for this release: It's My Mother’s Birthday Today and Footsteps Deleted scene Trailer","Brand Upon the Brain!","Brand Upon the Brain! A Remembrance in 12 Chapters",https://www.imdb.com/title/tt0443455/,Movie,7.3,95,2006,"Comedy, Drama, Fantasy, Horror, Romance, Sci-Fi",3827,2008-09-24,"Guy Maddin",,
460,tt0041886,2019-12-05,2020-08-11,"Audio Commentary by film scholar Charles Barr New video interview with cinematographer Christopher Challis Excerpts from Michael Powell’s audio dictations for his autobiography ","The Small Back Room","The Small Back Room",https://www.imdb.com/title/tt0041886/,Movie,7.1,106,1949,"Drama, Romance, Thriller, War",3561,1952-02-23,"Michael Powell, Emeric Pressburger",,
461,tt0047281,2019-12-05,2020-08-11,"New video interview with Japanese cinema historian and critic Tadao Sato about the film and its director","Twenty-Four Eyes","Nijûshi no hitomi",https://www.imdb.com/title/tt0047281/,Movie,8.0,156,1954,"Drama",3104,1954-09-15,"Keisuke Kinoshita",,
462,tt0042906,2019-12-05,2020-08-11,"Audio Commentary by film scholar Susan White, author of The Cinema of Max Ophuls Interview with Max Ophuls's son, Academy Award–winning filmmaker Marcel Ophuls Interview with actor Daniel Gélin Interview with film scholar Alan Williams Correspondence between Sir Laurence Olivier and Heinrich Schnitzler (the playwright's son), illustrating the controversy surrounding the source play","La Ronde","La ronde",https://www.imdb.com/title/tt0042906/,Movie,7.5,93,1950,"Drama, Romance",6283,1951-09-20,"Max Ophüls",,
463,tt0045034,2019-12-05,2020-08-11,"Introduction by filmmaker Todd Haynes (Far from Heaven) English- and German-language versions of the opening narration From Script to Screen, a video essay featuring film scholar Jean-Pierre Berthomé discussing the evolution of Max Ophuls’s screenplay for Le plaisir Interviews with actor Daniel Gélin, assistant director Tony Aboyantz, and set decorator Robert Christidès","Le Plaisir","Le plaisir",https://www.imdb.com/title/tt0045034/,Movie,7.5,97,1952,"Comedy, Drama, Romance",5658,1954-05-19,"Max Ophüls",,
464,tt0046022,2019-12-05,2020-08-11,"Audio Commentary by film scholars Susan White and Gaylyn Studlar Introduction by filmmaker Paul Thomas Anderson Interviews with director Max Ophuls’s collaborators Alan Jessua, Marc Frédérix, and Annette Wademant Visual essay by film scholar Tag Gallagher Interview with writer Louise de Vilmorin about Ophuls’s adaptation of her novel ","The Earrings of Madame De...","Madame de...",https://www.imdb.com/title/tt0046022/,Movie,7.9,105,1953,"Drama, Romance",11746,1954-07-19,"Max Ophüls",,
465,tt0056444,2019-12-05,2020-08-11,"Audio Commentary by film scholar David Bordwell, author of Ozu and the Poetics of Cinema Excerpts from “Yasujiro Ozu and The Taste of Sake,” a 1978 episode of the French television program Ciné regards, featuring critics Michel Ciment and Georges Perec, that looks back on Ozu’s career Trailers","An Autumn Afternoon","Sanma no aji",https://www.imdb.com/title/tt0056444/,Movie,8.0,113,1962,"Drama",11493,1964,"Yasujirô Ozu",,
466,tt0054821,2019-12-05,2020-08-11,"Selected-scene Audio Commentary by film scholar Ginette Vincendeau, author of Jean-Pierre Melville: An American in Paris Video interviews with directors Volker Schlöndorff and Bertrand Tavernier, who served as assistant director and publicity agent, respectively, on the film Archival interviews with Melville and actors Jean-Paul Belmondo and Serge Reggiani Original theatrical trailer","Le Doulos","Le doulos",https://www.imdb.com/title/tt0054821/,Movie,7.7,108,1962,"Crime, Thriller",12790,1964-03-02,"Jean-Pierre Melville",,
467,tt0060305,2019-12-05,2020-08-11,"Audio Commentary by film scholar Ginette Vincendeau, author of Jean-Pierre Melville: An American in Paris and film critic Geoff Andrew of the British Film Institute New video interview with director Bertrand Tavernier, who served as publicity agent on the film Archival footage featuring interviews with Melville and actor Lino Ventura Original theatrical trailer","Le deuxième souffle","Le deuxième souffle",https://www.imdb.com/title/tt0060305/,Movie,7.9,150,1966,"Crime, Drama",7199,1966-11-01,"Jean-Pierre Melville",,
468,tt0084335,2019-12-05,2020-08-11,"Video interviews with Costa-Gavras, Joyce Horman (wife of Charles Horman), producers Edward and Mildred Lewis and Sean Daniel, and Thomas Hauser, author of The Execution of Charles Horman, the film’s source Video interviews from the 1982 Cannes Film Festival with Costa-Gavras, Jack Lemmon, Ed Horman (father of Charles), and Joyce Horman Video interview with Peter Kornbluh, author of The Pinochet File, examining declassified documents concerning the 1973 military coup in Chile and the case of Charles Horman Highlights from the 2002 Charles Horman Truth Project event honoring Missing, with actors Sissy Spacek, John Shea, and Melanie Mayron, among others Theatrical trailer","Missing","Missing",https://www.imdb.com/title/tt0084335/,Movie,7.7,122,1982,"Biography, Drama, History, Mystery, Thriller",24831,1982-03-12,"Costa-Gavras",,
469,tt0115734,2019-12-05,2020-08-11,"Audio Commentary by Wes Anderson and co-writer/actor Owen Wilson The Making of Bottle Rocket: an original documentary by filmmaker Barry Braverman featuring Anderson, producer James L. Brooks, actors James Caan and Luke and Owen Wilson, and others The original thirteen-minute black-and-white Bottle Rocket short film from 1992 Eleven deleted scenes Anamorphic test, storyboards, location photos Behind-the-scenes photographs by Laura Wilson The Shafrazi Lectures, No. 1: Bottle Rocket Murita Cycles, a 1978 short film by Braverman","Bottle Rocket","Bottle Rocket",https://www.imdb.com/title/tt0115734/,Movie,6.9,91,1996,"Comedy, Crime, Drama",86584,1996-02-21,"Wes Anderson",,
470,tt0044602,2019-12-05,2020-08-11,"New video program about actor Gérard Philipe A clip from the colorized version of the film Theatrical trailer","Fanfan la Tulipe","Fanfan la Tulipe",https://www.imdb.com/title/tt0044602/,Movie,7.1,102,1952,"Adventure, Comedy, Romance, War",3628,1953-05-04,"Christian-Jaque",,
471,tt0059749,2019-12-05,2020-08-11,"Selected-scene Commentary by director of photography Oswald Morris Interview with author John le Carré from 2008 The Secret Centre: John le Carré (2000), a BBC documentary on the author’s extraordinary life and work A 1967 interview with Richard Burton from the BBC series Acting in the 60’s, conducted by film critic Kenneth Tynan An audio conversation from 1985 between director Martin Ritt and film historian Patrick McGilligan Gallery of set designs Theatrical trailer","The Spy Who Came in from the Cold","The Spy Who Came in from the Cold",https://www.imdb.com/title/tt0059749/,Movie,7.5,112,1965,"Drama, Thriller",19898,1965-12-16,"Martin Ritt",,
472,tt0109424,2019-12-05,2020-08-12,"Audio Commentary by Asian cinema critic Tony Rayns U.S. theatrical trailer Episode excerpt from the BBC Television series Moving Pictures, featuring Wong and cinematographer Christopher Doyle","Chungking Express","Chung Hing sam lam",https://www.imdb.com/title/tt0109424/,Movie,7.9,102,1994,"Comedy, Crime, Drama, Mystery, Romance",105212,1996-03-08,"Wong Kar-Wai",,
473,tt0101829,2019-12-05,2020-08-12,"Audio Commentary by director Lars von Trier and producer Peter Aalbæk Jensen (in Danish, with English subtitles) The Making of “Europa” (1991), a documentary following the film from storyboarding to production Trier’s Element (1991), a documentary featuring an interview with von Trier, and footage from the set and Europa’s Cannes premiere and press conference Anecdotes from Europa (2005), a short documentary featuring interviews with film historian Peter Schepelern, actor Jean-Marc Barr, producer Peter Aalbæk Jensen, assistant director Tómas Gislason, co-writer Niels Vørsel, and prop master Peter Grant 2005 interviews with cinematographer Henning Bendtsen, composer Joachim Holbek, costume designer Manon Rasmussen, film-school teacher Mogens Rukov, editor/director Tómas Gislason, producer Peter Aalbæk Jensen, art director Peter Grant, actor Michael Simpson, production manager Per Arman, actor Ole Ernst A conversation with Lars von Trier from 2005, in which the director speaks about the Europa trilogy Europa—The Faecal Location (2005), a short film by Gislason","Europa","Europa",https://www.imdb.com/title/tt0101829/,Movie,7.5,108,1991,"Crime, Drama, Thriller",24112,1991-06-27,"Lars von Trier",,
474,tt0084899,2019-12-05,2020-08-12,"New video interviews with producer Davison, co-writer Curtis Hanson, and Sam Fuller’s widow, Christa Lang-Fuller An interview with dog trainer Karl Lewis-Miller Rare photos from the film’s production","White Dog","White Dog",https://www.imdb.com/title/tt0084899/,Movie,7.0,90,1982,"Drama, Horror",11322,1982-07-07,"Samuel Fuller",,
475,tt0060860,2019-12-05,2020-08-12,"Taking Power, a multimedia essay by Tag Gallagher, author of The Adventures of Roberto Rossellini Video interview with artistic advisor Jean Dominique de la Rochefoucauld and script supervisor Michelle Podroznik Video interview with Renzo Rossellini","The Taking of Power by Louis XIV","La prise de pouvoir par Louis XIV",https://www.imdb.com/title/tt0060860/,TV Movie,7.1,90,1966,"Biography, History",1793,1966-10-08,"Roberto Rossellini",,
476,tt0047203,2019-12-05,2020-08-12,"Audio Commentary by film scholar Thomas Doherty Magnificent Obsession, John M. Stahl’s 1935 adaptation of the same novel, newly restored From UFA to Hollywood: Douglas Sirk Remembers (1991), a documentary by Eckhart Schmidt Interview from 2009 with screenwriter Robert Blees Interviews from 2008 with filmmakers Allison Anders and Kathryn Bigelow, in which they pay tribute to director Douglas Sirk Trailer","Magnificent Obsession","Magnificent Obsession",https://www.imdb.com/title/tt0047203/,Movie,7.0,108,1954,"Drama, Romance",8088,1954-08-07,"Douglas Sirk",,
477,tt0085482,2019-12-05,2020-08-12,"Audio Commentary by director Gregory Nava In the Service of the Shadows: The Making of El Norte: a new video program featuring interviews with Nava, producer and co-writer Anna Thomas, actors Zaide Silvia Gutiérrez and David Villalpando, and set designer David Wasco The Journal of Diego Rodriguez Silva, Nava's 1972 award-winning student film Gallery of Chiapas location-scouting photographs Theatrical trailer","El Norte","El Norte",https://www.imdb.com/title/tt0085482/,Movie,7.7,141,1983,"Adventure, Drama",5908,1984-01-27,"Gregory Nava",,
478,tt0056732,2019-12-05,2020-08-12,"The Last Script: Remembering Luis Buñuel, a 2008 documentary featuring screenwriter Jean-Claude Carrière and filmmaker Juan Luis Buñuel Interviews with actor Silvia Pinal and filmmaker Arturo Ripstein from 2006 Trailer","The Exterminating Angel","El ángel exterminador",https://www.imdb.com/title/tt0056732/,Movie,8.0,95,1962,"Drama, Fantasy",37187,1967-08-21,"Luis Buñuel",,
479,tt0059719,2019-12-05,2020-08-12,"A Mexican Buñuel (1995), 50-minute documentary by Emilio Maillé New interview with actress Silvia Pinal","Simon of the Desert","Simón del desierto",https://www.imdb.com/title/tt0059719/,Movie,7.8,45,1965,"Comedy, Drama, Fantasy",11441,1970-02-09,"Luis Buñuel",,
480,tt0047094,2019-12-05,2020-08-12,"Audio Commentary by film scholars Alain Silver and James Ursini, co-authors of David Lean and His Films The Hollywood Greats: Charles Laughton, a 1978 BBC documentary about the actor’s life and career, featuring interviews with his family, friends, and colleagues Theatrical trailer","Hobson's Choice","Hobson's Choice",https://www.imdb.com/title/tt0047094/,Movie,7.7,108,1954,"Comedy, Drama, Romance",9583,1954-04-19,"David Lean",,
481,tt0080610,2019-12-05,2020-08-12,"Audio Commentary by Annette Insdorf, author of François Truffaut Audio Commentary by Gérard Depardieu, historian Jean-Pierre Azéma, and Truffaut biographer Serge Toubiana Deleted scene French television excerpts of interviews with Truffaut, and actors Catherine Deneuve, Depardieu, and Jean Poiret New video interviews with actresses Andréa Ferréol, Sabine Haudepin, and Paulette Dubost, assistant director Alain Tasma, and camera assistants Florent Bazin and Tessa Racine A video interview with the celebrated cinematographer Nestor Almendros, detailing his collaborations with Truffaut Une histoire d’eau, Truffaut’s 1958 short film co-directed by Jean-Luc Godard Theatrical trailer","The Last Metro","Le dernier métro",https://www.imdb.com/title/tt0080610/,Movie,7.3,132,1980,"Drama, Romance, War",16552,1981-02-19,"François Truffaut",,
482,tt0053856,2019-12-05,2020-08-12,"New video interviews with Isabella, Renzo, and Ingrid Rossellini, as well as film scholar Adriano Aprà The Choice, a new visual essay by Tag Gallagher, author of The Adventures of Roberto Rossellini Original theatrical trailer","General Della Rovere","Il generale Della Rovere",https://www.imdb.com/title/tt0053856/,Movie,7.7,129,1959,"Drama, War",3914,1959-11-11,"Roberto Rossellini",,
483,tt0083789,2019-12-05,2020-08-12,"Video interviews with director Andrzej Wajda, screenwriter Jean-Claude Carrière, and Polish film critic Jerzy Plazewski Wajda’s Danton, a 42-minute behind-the-scenes documentary on the making of the film Original theatrical trailer","Danton","Danton",https://www.imdb.com/title/tt0083789/,Movie,7.4,136,1983,"Biography, Drama, History",8103,1983-01-12,"Andrzej Wajda",,
484,tt0065649,2019-12-05,2020-08-12,"Akira Kurosawa: It Is Wonderful to Create, a 36-minute documentary created as part of the Toho Masterworks series, about the making of Dodes’ka-den, including interviews with director Akira Kurosawa, script supervisor Teruyo Nogami, actor Yoshitaka Zushi, and other members of the cast and crew Theatrical trailer","Dodes'ka-den","Dodesukaden",https://www.imdb.com/title/tt0065649/,Movie,7.3,140,1970,"Drama",8048,1974-10-17,"Akira Kurosawa",,
485,tt0074102,2019-12-05,2020-08-12,"Audio Commentary by film critic Tony Rayns Interview from 2009 with actor Tatsuya Fuji A 1976 interview with director Nagisa Oshima and actors Fuji and Eiko Matsuda, and a 2003 program featuring interviews with consulting producer Hayao Shibata, line producer Koji Wakamatsu, assistant director Yoichi Sai, and film distributor Yoko Asakura Deleted footage and U.S. trailer","In the Realm of the Senses","Ai no korîda",https://www.imdb.com/title/tt0074102/,Movie,6.6,109,1976,"Drama, Romance",24261,1977-04-01,"Nagisa Ôshima",,
486,tt0077132,2019-12-05,2020-08-12,"Double Obsession: Seki, Sada, and Oshima, a new video essay by film historian and critic Catherine Russell New interviews with actors Kazuo Yoshiyuki and Tatsuya Fuji An interview program from 2003 featuring production consultant Koji Wakamatsu and assistant directors Yusuke Narita and Yoichi Sai U.S. trailer Optional English-dubbed soundtrack","Empire of Passion","Ai no bôrei",https://www.imdb.com/title/tt0077132/,Movie,7.0,105,1978,"Drama, Horror, Romance",5384,1979-03-26,"Nagisa Ôshima",,
